Oczywiście najtańszą energię otrzymuje się z turbin wiatrowych i instalacji solarnych.;Of course, the cheapest energy comes from wind turbines and solar installations.;wiatrowych;;
To tylko mój pies, Jobie.;It's just my dog, Job.;Jobie;;
Ale to poszło bardzo super, bo mnie nie dotknął koronawirus.;But that went very well because I wasn't touched by the coronavirus.;koronawirus;;
Ponadto musimy używać więcej energii odnawialnej i ulepszyć wydajność energetyczną.;Furthermore, we need to use more renewable energy and improve energy efficiency.;odnawialnej;;
Przeciwnicy mówią o odpadach radioaktywnych.;The opponents are talking about radioactive waste.;odpadach;;
Archipelag Svalbard Ok, to tyle na temat energii i sposobów jej pozyskiwania.;Svalbard Archipelago Ok, is so much about energy and how to obtain it.;Svalbard;;
Na razie tak nie jest, dlatego używa się energii z węgla lub ropy naftowej, a to niestety bardzo zanieczyszcza środowisko.;This is not the case so far, which is why coal or oil energy is used, and this, unfortunately, pollutes the environment very much.;zanieczyszcza;;
Tyle osób umiera rocznie w wypadkach i w wyniku zanieczyszczonego powietrza, w samej Polsce.;So many people die each year in accidents and as a result of contaminated air in Poland itself.;zanieczyszczonego;;
Oczywiście najtańszą energię otrzymuje się z turbin wiatrowych i instalacji solarnych.;Of course, the cheapest energy comes from wind turbines and solar installations.;solarnych;;
Gdy paliwo nuklearne jest już nieużyteczne do generowania prądu elektrycznego, jest składowane w basenach z wodą i kwasem borowym przez co najmniej 5 lat.;When nuclear fuel is no longer useful for generating electricity, it is stored in pools with water and boric acid for at least 5 years.;składowane;;
Kiedy myślimy elektrownia jądrowa, to od razu przychodzi nam na myśl skojarzenie radioaktywność, śmierć.;When we think of a nuclear power plant, we immediately think of the association of radioactivity, death.;radioaktywność;;
Pozdrawiam Cię bardzo serdecznie i życzę powodzenia!;I greet you very warmly and wish you good luck!;Pozdrawiam;;
Słyszałem, że w niektórych stanach w USA ludzie przestali nosić maseczki.;I heard that in some states in the United States, people stopped wearing masks.;niektórych;;
Ale co ciekawe nasz obecny rząd w 2018 roku zapowiedział, że wiatraki które już stoją zostaną zlikwidowane do 2035 roku i nie będą budowane nowe na ich miejsce.;But interestingly, our current government in 2018 announced that windmills that are already standing will be destroyed by 2035, and will not be built new to replace them.;zapowiedział;;
To jest właśnie największy problem tak zwanych odnawialnych źródeł energii.;This is the biggest problem of so-called renewable energy sources.;zwanych;;
Taka cywilizacja wysyła pierwszych kolonizatorów do najbliższych układów gwiezdnych.;This civilization sends the first colonists to the nearest star systems.;kolonizatorów;;
Jeśli są tak samo słabo rozwinięte jak my, to nigdy się nie spotkamy, będziemy siedzieć sobie w naszych zakamarkach kosmosu i nigdy się nie spotkamy.;If they're as underdeveloped as we are, we'll never meet, we'll sit in our nooks of space and we'll never meet.;zakamarkach;;
I w sierpniu podano do wiadomości, że właśnie w atmosferze Wenus odkryto biomarkery.;And in August it was announced that biomarkers were discovered in the atmosphere of Venus.;biomarkery;;
W fizyce energię mierzy się w dżulach [J].;In physics, energy is measured in joules [J].;dżulach;;
Szukamy, szukamy, nasłuchujemy i nic.;We look, we look, we listen and nothing.;nasłuchujemy;;
W ciągu 40 milionów lat taka cywilizacja mogłaby skolonizować całą naszą galaktykę.;In 40 million years, such a civilization could colonize our entire galaxy.;skolonizować;;
Po pewnym czasie koloniści stracili interes, żeby kontynuować ten projekt.;After a while, the colonists lost their business to continue this project.;koloniści;;
Nie spodziewałem się na początki, że zostanę w Polsce tak długo, ale z powody pandemii postanowiliśmy, że lepiej nie wracać w tej chwili do Stanów i dlatego, że jest teraz stan wyjątkowy w Polsce mogę zostać tutaj legalnie do końca koronawirus, ale kto wie kiedy to będzie.;I did not expect to stay in Poland for so long, but because of the pandemic we decided that it is better not to go back to the States at the moment and because there is a state of emergency in Poland now I can stay here legally until the end of the coronavirus, but who knows when it will be.;koronawirus;;
Enrico Fermi, włosko-amerykański fizyk zdał sobie sprawę, to było w latach 50.;Enrico Fermi, an Italian-American physicist realized it was in the '50s.;Fermi;;
Jeśli przeniesiemy się dwa poziomy, to będzie to nie dwadzieścia, ale 100 raz wyżej, jeśli trzy poziomy to 1000 razy i tak dalej.;If we move two levels, it's not 20, but 100 times higher, if three levels are 1,000 times and so on.;1000;;
Jeśli tylko słucham i siedzę albo leżę, to po kilku, może kilkunastu minutach po prostu usypiam… i nie ma znaczenia jak bardzo jest to interesujący podcast.;If I just listen and sit or lie down, then after a few minutes, maybe a few minutes, I just go to sleep... and it doesn't matter how interesting this podcast is.;usypiam;;
Niektórzy ludzie bardzo chcą spotkać inną cywilizacją, albo przynajmniej usłyszeć jakąś wiadomość od nich.;Some people really want to meet another civilization, or at least hear a message from them.;Niektórzy;;
Im wystarcza 40 milionów, a galaktyka trwa już 12 miliardów… Oczywiście, wiadomo, nie wszystkie cywilizacje chcą to zrobić.;Their 40 million is enough, and the galaxy is already 12 billion... of course, you know, not all civilizations want to do it.;wystarcza;;
4 lata świetlne to 1460 dni świetlnych, zatem nasza podróż zajmie: 1460 razy 40, czyli 58 tysięcy 400 lat.;4 light years is 1460 light days, so it's going to take us 1460 times 40, which is 58,000 400 years.;1460;;
Kiedyś Giordano Bruno zapytał o to, czy skoro istnieją inne planety krążące wokół innych gwiazd, to istnieją tam też inne istoty, i czy te istoty stworzył inny Bóg, czy ten sam który stworzył nas.;Once Giordano Bruno asked if there were other planets around other stars, there were other beings there, and whether these beings were created by another God or by the same one who created us.;Giordano;;
Jednak dziś tę skalę trochę zmieniono, bo przecież nie konsumujemy całej energii ziemskiej, i naszą cywilizację oznaczono jako typ 0.;However, today this scale has changed slightly, because we do not consume all of Earth's energy, and our civilisation has been marked as type 0.;konsumujemy;;
Naukowcy doszli do wniosku, że jest to planetoida lub kometa, która przyleciała do nas spoza naszego Układu Słonecznego.;Scientists have come to the conclusion that it is an asteroid or a comet that has come to us from outside our solar system.;planetoida;;
Przypominam, że od najbliższej gwiazdy, Proxima Centauri, dzielą nas 4 lata świetlne.;I remind you that from the nearest star, Proxima Centauri, we are four light-years away.;Proxima;;
Tak było aż do roku 1972, kiedy młody Amerykanin, Bobby Fischer pokonał rosyjskiego mistrza Borisa Spasskiego.;That was until 1972, when a young American, Bobby Fischer defeated Russian champion Boris Spassky.;Spasskiego;;
Paul Morphy, nieoficjalny mistrz świata Jednym z nich jest Paul Morphy, amerykański szachista uważany za pierwszego mistrza świata.;Paul Morphy, unofficial world champion One of them is Paul Morphy, an American chess player considered the world's first champion.;Morphy;;
Z Karpowem wygrał Kasparow.;Karpov was won by Kasparov.;Karpowem;;
Z Karpowem wygrał Kasparow.;Karpov was won by Kasparov.;Kasparow;;
Oczywiście ten serial nie opowiada o prawdziwych wydarzeniach, to wszystko jest fikcją, ale w serialu możemy usłyszeć nazwiska prawdziwych szachistów.;Of course, this show doesn't talk about real events, it's all fiction, but in the show we can hear the names of real chess players.;szachistów;;
Spotykali się wiele razy i walka między Karpowiem i Kasparowem była naprawdę zacięta.;They met many times, and the fight between Karp and Kasparov was really fierce.;Kasparowem;;
Ale pojawił się kolejny kandydat na mistrza świata, to był Rosjanin Anatolij Karpow i Fisher powinien rozegrać z nim mecz.;But there was another candidate for the world championship, and it was Russian Anatoli Karpov and Fisher should have played a game with him.;Karpow;;
Dwaj najlepsi szachiści tamtych czasów spotkali się ze sobą, to był Steinitz i Zukertort.;The two best chess players of that time met each other, it was Steinitz and Zukertort.;najlepsi;;
Rosjanin Władimir Kramnik, Hindus Viswanathan Anand, trudne imię, Viswanathan nie wiem jak się wymawia Viswanathan Anand, Anand ma na nazwisko i obecny mistrz, Norweg, Magnus Carlsen.;Russian Vladimir Kramnik, Indian Viswanathan Anand, tough name, Viswanathan I don't know how to pronounce Viswanathan Anand, Anand has the name and current master, Norway, Magnus Carlsen.;Carlsen;;
Co jakiś czas jest jakiś krótki tekścik, który również ma audio, ale te tekściki są bardzo nudne, przynajmniej dla mnie.;Every now and then there's a little song that also has audio, but these songs are very boring, at least for me.;tekścik;;
Od dziecka był uważany przez Amerykanów za geniusza.;Ever since he was a kid, he's been considered a genius by Americans.;Amerykanów;;
Kasparow został zdyskwalifikowany za grę zorganizowaną przez prywatnego sponsora i to spowodowało, że postanowił założyć własną organizację.;Kasparov was disqualified for a game organized by a private sponsor and this led him to set up his own organization.;zdyskwalifikowany;;
W 1972 roku w Reykjaviku doszło do meczu Spasski kontra Fischer.;In 1972 in Reykjavik there was a Spasski versus Fischer match.;Reykjaviku;;
I domyślacie się, oczywiście wygrał wszystkie partie i tylko jedną zremisował.;And you can guess, of course, he won all the games and only tied one.;zremisował;;
Stany Zjednoczone wprowadziły sankcje gospodarcze na Jugosławię, bo Jugosławia prowadziła wtedy wojnę w Bośni, i Złamanie tych sankcji przez Fischera groziło mu karą 10 lat więzienia.;The United States imposed economic sanctions on Yugoslavia because Yugoslavia was at the time at war in Bosnia, and Fischer's violation of those sanctions threatened him with 10 years in prison.;sankcje;;
Nasz aktor zagrał arcymistrza szachowego, z którym oczywiście zmierzyła się główna bohaterka serialu.;Our actor played the Grandmaster of Chess, which, of course, was the main character of the show.;arcymistrza;;
Być może słyszeliście o Cicada 3301, będę mówił po polsku, chyba będzie tak lepiej, po prostu Cykada 3301.;Perhaps you have heard of Cicada 3301, I will speak Polish, I think it will be better, just Cicada 3301.;Cykada;;
Być może słyszeliście o Cicada 3301, będę mówił po polsku, chyba będzie tak lepiej, po prostu Cykada 3301.;Perhaps you have heard of Cicada 3301, I will speak Polish, I think it will be better, just Cicada 3301.;3301;;
Znacie już treść, więc będzie o wiele łatwiej zrozumieć polską wersję.;You already know the content, so it will be much easier to understand the Polish version.;łatwiej;;
I ta liczba, to był adres internetowy do strony, na której były umieszczone koordynaty geograficzne 14 miejsc w 5 różnych państwach na świecie.;And this number, it was an Internet address to a website where there were geographical coordinates of 14 places in 5 different countries around the world.;koordynaty;;
To jest naprawdę wspaniała metoda, ale niezwykle pracochłonna.;This is a really great method, but extremely laborious.;pracochłonna;;
Książka nosiła tytuł  Liber Primus  czyli po łacinie  Pierwsza Księga .;The book was called Liber Primus, which is Latin for the First Book.;Liber;;
Rozwiązujący zagadkę tym razem usłyszeli nagranie muzyczne, a potem zostali przekierowani na konto na Twitterze, gdzie znajdował się tekst napisany alfabetem runicznym.;The solver of the riddle this time heard a musical recording, and then they were redirected to a Twitter account where the text written in the rune alphabet was written.;runicznym;;
Pozdrawiam panią bardzo serdecznie!;I greet you very cordially!;Pozdrawiam;;
Klikam w ten link i widzę kolejny komunikat: Zablokowano działanie dotyczące poufnych danych Ponieważ próbujesz podjąć działanie dotyczące bardzo poufnych danych, musimy być pewni, że to naprawdę Ty, a w tej chwili nie mamy tej pewności.;I click on this link and see another message: Action on confidential data has been blocked Since you are trying to take action on very confidential data, we need to be sure that it is really you, and at the moment we do not know for sure.;poufnych;;
To był ciąg liter, ale teraz trzeba było to odszyfrować i po odszyfrowaniu dostawało się link do kolejnego obrazka.;It was a string of letters, but now it had to be decrypted and after decrypted you got a link to the next image.;odszyfrować;;
Niektórzy opierają swoje całe życie, swoje biznesy na takich usługach, na które zupełnie nie mają wpływu.;Some people base their whole lives, their businesses on services that are completely out of control.;Niektórzy;;
Okazuje się, że Cykada ostatecznie skontaktowała się z rekrutami, ale tylko w celu poinformowania ich, że w przyszłości się do nich odezwą, ale na razie powinni być cierpliwi i czekać.;It turns out that Cicada finally contacted the recruits, but only to inform them that they will speak to them in the future, but for now they should be patient and wait.;odezwą;;
Książka nosiła tytuł  Liber Primus  czyli po łacinie  Pierwsza Księga .;The book was called Liber Primus, which is Latin for the First Book.;Primus;;
Żeby wrzucić nowy filmik trzeba wejść na swoim koncie do tak zwanego Studio YT.;To add a new video, you have to enter into your account the so-called YT Studio.;zwanego;;
Co mówi Eckhart Tolle na temat nudy Oczywiście wykorzystanie wolnego czasu jest bardzo dobrym nawykiem.;What Eckhart Tolle says about boredom Of course the use of free time is a very good habit.;Tolle;;
Każdy spróbował, więc dokładnie wiedzieli jak to jest, jakie to jest uczucie być porażonym.;Everyone tried, so they knew exactly what it was like, what it felt like to be electrocuted.;porażonym;;
Niedawno Halina napisała komentarz pod podcastem o Tamarze Łempickiej i napisała tak — Dziękuję, Piotrze, jestem zachwycona tym podcastem, jestem zachwycona Tamarą Łempicką oraz jej obrazami.;Recently, Halina wrote a comment under the podcast about Tamara Łempicka and wrote such a commentary.Thank you, Peter, I am delighted with this podcast, I am delighted with Tamara Łempicka and her paintings.;Łempicką;;
Na koniec posłuchamy nagrania od Sebastiana.;Finally, we'll listen to Sebastian's footage.;Sebastiana;;
Co mówi Eckhart Tolle na temat nudy Oczywiście wykorzystanie wolnego czasu jest bardzo dobrym nawykiem.;What Eckhart Tolle says about boredom Of course the use of free time is a very good habit.;Eckhart;;
Niektórzy marzą o drodze na skróty, chcieliby nauczyć się nowego języka jak najszybciej.;Some dream of a shortcut, wishing to learn a new language as soon as possible.;Niektórzy;;
Ludzie woleli nawet nieprzyjemną stymulację od barku stymulacji.;People even preferred unpleasant stimulation from the shoulders of stimulation.;woleli;;
Ten termin, Ziemie Odzyskane, został spopularyzowany – trudne słowo – Spopularyzowany, czyli zrobili tak, żeby ludzie znali tę nazwę, komuniści to zrobili.;"This term, the Lands Recovered, has been popularized with the difficult word ""popularized,"" so they did so so that people knew the name, the communists did it.";spopularyzowany;;
Człowiekiem, który prawdopodobnie spędził najdłuższy okres czasu w izolacji był Thomas Silverstein.;The man who probably spent the longest period of time in isolation was Thomas Silverstein.;Silverstein;;
Oni wchodząc do pokoju wiedzieli, że tam jest przycisk, którego wciśnięcie porazi ich prądem.;When they entered the room, they knew there was a button that would electrocute them.;porazi;;
Oczywiście są również słuchacze z południowej półkuli, pozdrawiam wszystkich z Australii, Ameryki Południowej i Południowej Afryki.;Of course there are also listeners from the southern hemisphere, I greet everyone from Australia, South America and South Africa.;pozdrawiam;;
Jednak to wciąż nam nie wystarcza.;But that's still not enough for us.;wystarcza;;
Zimowa kurtka już nam się znudziła, czapka i szalik też, teraz chcę słońca i więcej ciepła, prawda?;We're tired of winter jacket, hat and scarf too, now I want sunshine and more heat, right?;znudziła;;
Jak zwykle moim zadaniem będzie zaciekawić Was swoją opowieścią, bo chcę pomóc Wam w nauce języka polskiego.;As usual, my task will interest you in my story, because I want to help you learn Polish.;zaciekawić;;
Niedawno Halina napisała komentarz pod podcastem o Tamarze Łempickiej i napisała tak — Dziękuję, Piotrze, jestem zachwycona tym podcastem, jestem zachwycona Tamarą Łempicką oraz jej obrazami.;Recently, Halina wrote a comment under the podcast about Tamara Łempicka and wrote such a commentary.Thank you, Peter, I am delighted with this podcast, I am delighted with Tamara Łempicka and her paintings.;Tamarą;;
Na czele tego buntu stał Wasyl Szujski.;At the head of this rebellion was Wasyl Szujski.;Szujski;;
Właściwie to jej starsza siostra powinna być żoną tego króla, bo na nią była kolej ale była bardzo brzydka i Jan Waza nie chciał jej za żonę, poprosił Katarzynę.;Actually, her older sister should have been married to that king because it was her turn but she was very ugly and Jan Waza didn't want her to be his wife, he asked Catherine.;Jan;;
Dawniej to nie było możliwe.;It wasn't possible in the old days.;Dawniej;;
Dlatego został potem nazwany Dymitrem Samozwańcem, bo sam się tak nazwał, sam się nazwał Dymitrem i królem, carem Rosji.;That's why he was later called Dmitry the Self-proclaimed, because he called himself that, he called himself Dmitry and the king, the tsar of Russia.;Samozwańcem;;
Były jednak plotki, że Iwan Groźny miał ze swoją ostatnią żoną, czyli siódmą żoną jeszcze jednego, najmłodszego syna o imieniu Dymitr.;But there were rumors that Ivan the Terrible had another youngest son named Dmitri with his last wife, or seventh wife.;Dymitr;;
Jego żoną była Anna Jagiellonka, córka Bony Sforzy i Zygmunta Starego, czyli siostra Zygmunta II Augusta, który to właśnie nie miał dzieci.;His wife was Anna Jagiellonian, daughter of Bony Sforza and Zygmunt Stary, or sister of Zygmunt II Augustus, who had no children.;Jagiellonka;;
Za pierwszym razem wybrano Francuza, Henryka Walezego, ale on nie wytrzymał tutaj w Polsce i bardzo szybko uciekł spowrotem do Francji.;The first time he chose a Frenchman, Henry Valez, but he could not stand here in Poland and fled very quickly back to France.;Walezego;;
Więc faktyczne rządy w Rosji sprawował doradca Iwana Groźnego, Borys Godunow.;So the actual government in Russia was administered by Ivan the Terrible, Boris Godunov.;Godunow;;
— Szybko koronował się na króla, żeby zdążyć przed Maksymilianem.;He quickly crowned the king before Maximilian.;koronował;;
Szlachta po prostu przyjechała na pole elekcyjne i odbywały się wybory.;The nobles simply came to an election field and the elections took place.;elekcyjne;;
Możecie słuchać bezpośrednio z mojej strony czyli realpolish.pl, ale możecie znaleźć podcast w aplikacjach z podcastami.;You can listen directly from my website - realpolish.pl, but you can find podcast in podcast applications.;czyli;;
Katarzyna Jagiellonka została żoną księcia Finlandii Jana III Wazy.;Katarzyna Jagiellonka became the wife of Prince Jan III Vasa of Finland.;Jana;;
Dlatego zaproponowali Zygmuntowi III Wazie, żeby jego syn, jego syn Władysław, ten co postawił kolumnę w Warszawie… później, później postawił… żeby jego syn został carem Rosji.;That's why they offered Zygmunt III Vazie to have his son, his son Władysław, the one who put up the column in Warsaw... later, then bet... his son to become the tsar of Russia.;Władysław;;
Po czterech latach siły polityczne w Szwecji się odmieniły i Eryk został zdetronizowany, a Jan i Katrzayna zostali uwolnieni.;After four years, the political forces in Sweden changed and Eric was deposed and John and Catherine were released.;zdetronizowany;;
Na nim skończyła się dynastia Jagiellonów i kolejny król został wybrany w tak zwanej wolnej elekcji.;It ended with the Jagiellonian dynasty and another king was elected in the so-called free election.;elekcji;;
Muszę powiedzieć, że mam mnóstwo słuchaczy z Białorusi, zatem przy okazji pozdrawiam wszystkich bardzo, bardzo serdecznie!;I must say that I have a lot of listeners from Belarus, so I greet everyone very, very cordially by the way!;pozdrawiam;;
Podobno lubił grać w piłkę nożną, albo tenisa.;He said he liked to play soccer or tennis.;nożną;;
Obecnie w Ameryce Łacińskiej, większość ludzi to Metysi, czyli ludzie, których jedno z rodziców to Indianin, a drugi rodzic należy do rasy białej.;Now in Latin America, most people are Methys, or people whose parents are Indian and the other parent is Caucasian.;Metysi;;
To ciekawe, ale dziś żyje 16 milionów ludzi  rdzennego pochodzenia.;That's interesting, but today there are 16 million people of indigenous origin.;rdzennego;;
Po polsku mówimy że to były cywilizacje prekolumbijskie, czyli te, które były przed Kolumbem.;In Polish we say that these were pre-Columbian civilizations, i.e. those that were before Columbus.;prekolumbijskie;;
W każdym razie tego dnia symbolicznie rozpoczyna się konkwista, czyli podbój tego kontynentu przez Hiszpanów.;In any case, that day symbolically begins the conquista, or conquest of this continent by the Spaniards.;konkwista;;
Hiszpańscy konkwistadorzy mieli dzieci z indiańskimi kobietami.;Spanish conquistadors had children with Indian women.;konkwistadorzy;;
Aztekowie poświęcali ludzi swoim bogom.;The Aztecs sacrificed people to their gods.;Aztekowie;;
W 2005 roku w prasie argentyńskiej można było przeczytać, że moment przybycia Kolumba rozpoczął eksterminację 90 milionów tubylców, że to był początek końca rozwoju kultury w tym regionie.;In 2005, the Argentine press read that the arrival of Columbus began the extermination of 90 million natives, that it was the beginning of the end of cultural development in the region.;tubylców;;
Zdobycie imperium Montezumy nie byłoby możliwe bez sojuszu z wieloma jego wrogami.;It would not have been possible to conquer the Montezuma empire without an alliance with many of its enemies.;Montezumy;;
Bartłomieja katolicy mordują 3000 francuskich hugenotów.;Bartholomew Catholics murder 3,000 French Huguguenots.;3000;;
Niektórzy myślą, że Inkwizycja miała coś wspólnego z zabijaniem Indian, ale to nie jest prawda.;Some people think the Inquisition had something to do with killing Indians, but that's not true.;Niektórzy;;
Ta książka była prezentem dla przeciwników Hiszpanii: protestantów z Niemiec, Holandii, Anglii, hugenotów z Francji.;This book was a gift for Spanish opponents: Protestants from Germany, Holland, England, Huguenots from France.;hugenotów;;
Jedyny zapis tego prawa mówi: Se declara Fiesta Nacional de España, a todos los efectos, el día 12 de octubre.;The only record of this law says: Se declara Fiesta Nacional de España, a todos los efectos, el día 12 de Octubre.;España;;
Ustanawia się Święto Narodowe Hiszpanii, ze wszystkimi skutkami, dnia 12 października.;The National Festival of Spain shall be established, with all consequences, on 12 October.;Ustanawia;;
Jedyny zapis tego prawa mówi: Se declara Fiesta Nacional de España, a todos los efectos, el día 12 de octubre.;The only record of this law says: Se declara Fiesta Nacional de España, a todos los efectos, el día 12 de Octubre.;octubre;;
Anglicy starali się eksploatować zasoby zdobytych terenów, a Hiszpanie starali się włączać zdobyte tereny pod swoje panowanie wprowadzając religię, zwyczaje, święta, przywożąc swoją technologię.;The English tried to exploit the resources of their land, and the Spanish tried to include the land they had gained under their rule by introducing religion, customs, festivals, and bringing their technology.;eksploatować;;
