Zamkni\u0119ta strefa buforowa    Wok\u00f3\u0142 Czarnobyla powsta\u0142a zamkni\u0119ta strefa buforowa.;The closure of the buffer zone Wok00f3 \u0142 Chernobyl is created and the closure of the buffer zone is closed.;buforowa;;
Amerykanie wiedzieli o wszystkim, ale ich opinia publiczna r\u00f3wnie\u017c nie zosta\u0142a wtedy poinformowana.;The Americans knew everything, but their public opinion was not informed then.;Amerykanie;;
Potem okaza\u0142o si\u0119, \u017ce opary o\u0142owiu, kt\u00f3re powsta\u0142y podczas gaszenia wyrz\u0105dzi\u0142y ogromne szkody osobom gasz\u0105cym ruiny.;Then it turned out to be a huge fumes of fumes, which were created during the extinction of the ruins.;powsta;;
Tak w\u0142a\u015bnie si\u0119 dzieje, poniewa\u017c nauka trwa d\u0142ugo, wszystko dzieje si\u0119 wolno, nawet nie zauwa\u017camy, \u017ce to si\u0119 dzieje.;So in the history of science it takes a long time, everything happens slowly, we don't even notice, it's happening.;poniewa;;
W 1957 roku dosz\u0142o do eksplozji, to nie by\u0142a eksplozja nuklearna, ale dziesi\u0105tki tysi\u0119cy ton odpad\u00f3w nuklearnych pokry\u0142y 40 tysi\u0119cy kilometr\u00f3w kwadratowych.;In 1957, it was not a nuclear explosion, but a ten thousand tons of nuclear waste covered by 40 thousand kilometers square.;dosz;;
W 2011 roku, po trz\u0119sieniu ziemi, a potem wielkim tsunami dosz\u0142o do uszkodzenia rdzenia elektrowni atomowej.;In 2011, after the reign of the land, and then a great tsunami, there was damage to the nuclear power plant's core.;tsunami;;
Ciesz\u0119 si\u0119, \u017ce przysy\u0142acie mi nagrania, w kt\u00f3rych m\u00f3wicie po polsku.;You're enjoying the good news that you're sending me videos in which you're speaking Polish.;przysy;;
Zamkni\u0119ta strefa buforowa    Wok\u00f3\u0142 Czarnobyla powsta\u0142a zamkni\u0119ta strefa buforowa.;The closure of the buffer zone Wok00f3 \u0142 Chernobyl is created and the closure of the buffer zone is closed.;Zamkni;;
Okazuje si\u0119, \u017ce w tej chwili promieniowanie na tym terenie nie jest ju\u017c bardzo du\u017ce.;It turns out that the radiation in this area is no longer very high.;promieniowanie;;
Tylko 100 km od stolicy Ukrainy, od Kijowa.;Only 100 km from the capital of Ukraine, from Kiev.;Kijowa;;
Za pi\u0119\u0107 godzin ochrona radiologiczna og\u0142osi\u0142a w Polsce alarm.;For five-seven hours, radiological protection of the Polish alarm system.;radiologiczna;;
Ja oczywi\u015bcie chc\u0119 pom\u00f3c wszystkim, kt\u00f3rzy chc\u0105 nauczy\u0107 si\u0119 m\u00f3wi\u0107 po polsku, to proste, j\u0119zyk kt\u00f3ry najlepiej znam to w\u0142a\u015bnie j\u0119zyk polski, m\u00f3wi\u0119 nim od ponad 50 lat i jest to po prostu m\u00f3j j\u0119zyk ojczysty.;I, of course, want to help everyone who wants to learn how to speak Polish, that's simple, that's the language that I know best about in English for over 50 years and that's just my mother tongue.;ojczysty;;
Ostatnio ogl\u0105da\u0142em film Ballada o Busterze Scruggsie, mo\u017cecie znale\u017a\u0107 ten film na Netflix, polecam, fajny film.;Last time I saw the Ballad movie about Buster Scruggs, you might find this movie on Netflix, I recommend a cool movie.;znale;;
Niekt\u00f3re agencje na zachodzie rozpowszechniaj\u0105 pog\u0142oski jakoby w czasie awarii w elektrowni atomowej zgin\u0119\u0142y tysi\u0105ce ludzi.;Some agencies in the west are spreading the poetry as if during a nuclear accident thousands of people died in the nuclear power plant.;zgin;;
B\u0119d\u0119 bardzo wdzi\u0119czna je\u017celi zwr\u00f3cicie moj\u0105 uwag\u0119 w czym potrzebnie (nad czym musz\u0119) pracowa\u0107 \u017ceby pozby\u0107 si\u0119 akcentu.;You're very grateful if you're paying my attention where you need to (where you need to work) to get rid of your accent.;pracowa;;
Pos\u0142uchajcie zdania po polsku i spr\u00f3bujcie je powt\u00f3rzy\u0107 jednocze\u015bnie nagrywaj\u0105c siebie.;Listen to the sentences in Polish and repeat them once again. At the same time, record yourself.;powt;;
Wybuch czwartego reaktora    26 kwietnia rozpocz\u0105\u0142 si\u0119 rutynowymi pracami, podobno symulowano sytuacj\u0119 krytyczn\u0105.;The explosion of the fourth reactor on April 26 began with routine work, supposedly simulated a critical situation.;sytuacj;;
My\u015bl\u0119, \u017ce po prostu umieraj\u0105, bo s\u0105 ju\u017c starymi lud\u017ami, bez pomocy medycznej, bez lekarstw, bez cywilizacji    Na teren Czarnobyla przyje\u017cd\u017caj\u0105 r\u00f3wnie\u017c naukowcy.;We think you're just dying because they're already old people, without medical help, without medicine, without civilization, they're coming to Chernobyl with scientists.;przyje;;
Dzi\u0119kuj\u0119 serdecznie, pozdrawiam wszystkich.;Today, I cordially greet you all.;pozdrawiam;;
Jednak co ciekawe CIA wiedzia\u0142a o wypadku nied\u0142ugo po wydarzeniu.;But what's interesting is the CIA knows about the accident shortly after the event.;nied;;
Jeden z kierowc\u00f3w wozu stra\u017cackiego opowiada\u0142, \u017ce gdy przyjechali do elektrowni widzieli le\u017c\u0105ce na ziemi kawa\u0142ki grafitu.;One of the drivers of the strašcacki car tells a story, when they arrived at the power plant they saw a few coffees of graphite on the ground.;grafitu;;
Z zak\u0142adu wycieka\u0142a ska\u017cona promieniowaniem woda, kt\u00f3re przedostawa\u0142a si\u0119 do rzeki i okolicznych jezior.;There's a leak of radiation in the water that gets through the river and the surrounding lakes.;okolicznych;;
My\u015bl\u0119, \u017ce tak na przyk\u0142ad \u0107wicz\u0105 aktorzy, tak sobie to wyobra\u017cam, \u017ce tak \u0107wicz\u0105 aktorzy, kt\u00f3rzy chc\u0105 m\u00f3wi\u0107 w filmie z konkretnym akcentem.;I'm thinking, for example, of the actors who want to make a movie with a specific accent.;wyobra;;
Tego dnia na zlecenie partii PZPR, pami\u0119tacie, \u017ce w tym czasie istnia\u0142a tylko jedna partia polityczna, w\u0142adze partii ustali\u0142y, \u017ce nale\u017cy dzieciom poda\u0107 p\u0142yn Lugola.;On that day, on behalf of the PZPR party, remember, there is only one political party, within the party's mandate, to establish the appropriate children's Lugol.;nale;;
Zapraszam do s\u0142uchania podcast\u00f3w, bo moim zdaniem w\u0142a\u015bnie s\u0142uchanie i czytanie daje wspania\u0142e rezultaty.;Welcome to podcasting, because in my opinion there are wonderful results in reading and reading.;wspania;;
Dziś posłuchamy nagrania od Lincolna.;Tonight we're gonna listen to Lincoln's footage.;Lincolna;;
Podobnie mają się sprawy jeśli chodzi o bioinżynierię.;The same is true of bioengineering.;bioinżynierię;;
Nie tak dawno polecałem Wam książki izraelskiego autora, Yuvala Harari, myślę tu o książkach “Sapiens – Od zwierząt do bogów” i o drugiej książce “Homo Deus – Krótka historia jutra”.;"Not long ago, I recommended to you the books of the Israeli author Yuvala Harari, here I am thinking about the books ""Sapiens "" from animals to gods and about the second book ""Homo Deus "" - The Short History of Tomorrow.";Yuvala;;
Nie tak dawno polecałem Wam książki izraelskiego autora, Yuvala Harari, myślę tu o książkach “Sapiens – Od zwierząt do bogów” i o drugiej książce “Homo Deus – Krótka historia jutra”.;"Not long ago, I recommended to you the books of the Israeli author Yuvala Harari, here I am thinking about the books ""Sapiens "" from animals to gods and about the second book ""Homo Deus "" - The Short History of Tomorrow.";Harari;;
Tam ludzie myślą, że Meksykanie zabierają pracę Amerykanom, może jeszcze tak jest, ale w niedalekiej przyszłości to roboty i algorytmy zabiorą pracę Amerykanom, nie Meksykanie.;There people think the Mexicans are taking American jobs, maybe they are, but in the near future, robots and algorithms are gonna take American jobs, not Mexicans.;Amerykanom;;
Ja mieszkam w Europie i ostatnie setki lat historii świata wyglądały tak, że Europejczycy kolonizowali świat.;I live in Europe and the last hundreds of years of world history have looked like Europeans colonized the world.;kolonizowali;;
Dziś chciałbym zwrócić Waszą uwagę na dwa nurty, dwa nurty, które tak mi się wydaje walczą obecnie ze sobą, myślę tu o globalizmie i nacjonalizmie.;Today I would like to draw your attention to two currents, two currents that I think are currently fighting each other, here I am thinking about globalism and nationalism.;globalizmie;;
W tej chwili podział staje się trochę inny, mamy podział na globalistów i nacjonalistów, albo lokalistów, nie wiem czy jest takie słowo — lokaliści — chyba wymyśliłem właśnie nowe słowo.;"At the moment the division becomes a little bit different, we have a division between globalists and nationalists, or localists, I don't know if that's the word ""localities"" I think I just came up with a new word.";globalistów;;
Nagranie od Krysi Zanim zacznę mówić na ten temat, chcę żeby najpierw powiedziała coś Krysia z Tajwanu.;Before I start talking about it, I want her to say something to Krysia from Taiwan first.;Krysi;;
Zatem, te grupy to po pierwsze naukowcy, którzy uważają, że ostatnie zmiany klimatu są spowodowane przez wpływ człowieka, przede wszystkim przez spalanie paliw kopalnych, czyli gazu, węgla i ropy naftowej.;Thus, these groups are first of all scientists who believe that recent climate change is caused by human influence, primarily by burning fossil fuels, namely gas, coal and oil.;spalanie;;
Większość naukowców z tej grupy należy do Międzyrządowego Zespołu do spraw Zmian Klimatu, tak, tak to się nazywa Międzyrządowy Zespół do spraw Zmian Klimatu, skrót angielski to IPCC.;Most of the scientists in this group belong to the Intergovernmental Panel on Climate Change, yes, that's what we call the Intergovernmental Panel on Climate Change, the English abbreviation is the IPCC.;Międzyrządowego;;
Po polsku taki pas ruchu nazywa się buspas, bo jeżdżą tam tylko autobusy i taksówki.;In Polish such a lane is called buspas, because only buses and taxis go there.;buspas;;
Nagranie od Krysi Zanim zacznę mówić na ten temat, chcę żeby najpierw powiedziała coś Krysia z Tajwanu.;Before I start talking about it, I want her to say something to Krysia from Taiwan first.;Krysia;;
W Średniowieczu było cieplej średnio o 1C, potem było to oziębienie, ta Mała Epoka Lodowa, a teraz znowu robi się cieplej i znowu mamy temperatury podobne do tych jak w Średniowieczu.;In the Middle Ages it was warmer by an average of 1C, then it was colder, this Little Ice Age, and now it gets warmer again and again we have temperatures similar to those in the Middle Ages.;oziębienie;;
Moi drodzy, ostatnio opowiadałem trochę o sceptykach, o tym że sceptycy nie wierzą we wszystko to co mówią inni, tylko sprawdzają to.;Ladies and gentlemen, lately I've been talking a little bit about skeptics, about the fact that skeptics don't believe everything other people say, they just check it out.;sceptykach;;
Dziś jest 15C, a jutro może być nawet 20C.;Today's 15C, and tomorrow maybe even 20C.;15C;;
Co ciekawe niektórzy sceptycy nie wierzą nawet sobie, ponieważ uważają, że ich zmysły mogą się mylić, a nawet podejrzewają, że jesteśmy specjalnie oszukiwani przez symulację, w której żyjemy.;Interestingly, some skeptics do not even believe themselves because they think that their senses may be wrong or even suspect that we are deliberately deceived by the simulation in which we live.;niektórzy;;
Moi drodzy, ostatnio opowiadałem trochę o sceptykach, o tym że sceptycy nie wierzą we wszystko to co mówią inni, tylko sprawdzają to.;Ladies and gentlemen, lately I've been talking a little bit about skeptics, about the fact that skeptics don't believe everything other people say, they just check it out.;sceptycy;;
Po prostu dziś chcę, tak jak sceptycy, sprawdzić pewną informację, chodzi mi o tak zwane globalne ocieplenie.;I just want to see some information today, just like skeptics, about what's called global warming.;zwane;;
Pozdrawiam serdecznie, pa, pa!;Greetings, bye-bye!;Pozdrawiam;;
Rośliny emitują tlen, który jest konsumowany przez zwierzęta, a zwierzęta emitują dwutlenek węgla, który jest konsumowany przez rośliny.;Plants emit oxygen, which is consumed by animals, and animals emit carbon dioxide, which is consumed by plants.;konsumowany;;
W tym czasie nie było lodu na biegunach, w Arktyce rosły palmy.;At that time there was no ice at the poles, palm trees were growing in the Arctic.;Arktyce;;
Posłuchajmy razem co powiedział Kenn.;Let's hear what Kenn said together.;Kenn;;
Najgorsze jest to, że starzenie się jest po prostu efektem ubocznym tego, że w ogóle żyjemy.;The worst part is that aging is just a side effect of living at all.;starzenie;;
Najstarszym zwierzęciem na świecie podobno jest koralowiec, który żyje ponad 4 tysiące lat… ale koralowiec, to dość dziwne zwierzę, żyje w wodzie i całe życie spędza w jednym miejscu.;The oldest animal in the world is supposed to be a coral that lives over 4,000 years... but a coral, it's a pretty strange animal, lives in water and spends his whole life in one place.;koralowiec;;
Niedawno dostałem nagranie od Kenna z Danii.;I just got a video from Kenna from Denmark.;Kenna;;
Życzę Wam wszystkim dobrego zdrowia, szczególnie teraz z sytuacją z koronawirusem.;I wish you all good health, especially now with the situation with the coronavirus.;koronawirusem;;
Jestem również poliglotą, poza tym muzykiem i piosenkarzem w wolnym czasie.;I'm also a polyglot, except for this musician and singer in my spare time.;poliglotą;;
Ale po pewnym czasie przestał go remontować, przestał remontować swój dom.;But after a while, he stopped renovating it, stopped renovating his house.;remontować;;
Jeśli chcesz posłuchać niektórych z tych utworów, możesz to zrobić na YouTube.;If you want to listen to some of these songs, you can do it on YouTube.;niektórych;;
Można powiedzieć, że ta meduza może się odmłodzić.;You could say that jellyfish could rejuvenate.;meduza;;
Istnieje terapia komórkowa, gdzie wykorzystuje się tak zwane komórki macierzyste, które mają możliwość regeneracji uszkodzonych tkanek.;There is cellular therapy where so-called stem cells are used, which have the ability to regenerate damaged tissues.;zwane;;
Czasami niektórzy czytają książkę jak najszybciej.;Sometimes some people read the book as soon as possible.;niektórzy;;
Kiedyś mówiłem już Wam o metodzie Kaizen.;I once told you about the Kaizen method.;Kaizen;;
Wciąż potrzebuję pewnego rozmachu, rozbiegu.;I still need some momentum, a runaway.;rozbiegu;;
Przypuśćmy, że 10 stron to będzie maksimum co mogę przeczytać, co jestem w stanie przeczytać.;Suppose 10 pages is the maximum I can read, what I can read.;Przypuśćmy;;
Na szczęście, kiedy dużo później szukałem na własną rękę jakiejś metody nauki, dowiedziałem się jak ważne jest słuchanie, jak ważna jest systematyczność i o tym chcę dzisiaj Wam opowiedzieć.;Fortunately, when I was looking for a method of learning on my own a lot later, I learned how important it is to listen, how important it is to be systematic, and I want to tell you about it today.;systematyczność;;
W Polsce najbardziej popularnym sportem jest piłka nożna.;Football is the most popular sport in Poland.;nożna;;
Fajna piosenka, dzięki Kenn.;Nice song, thanks, Kenn.;Kenn;;
Nie tak dawno dostałem email z nagraniem od Pawła z Ukrainy.;Not long ago I received an email with a recording from Paul from Ukraine.;Pawła;;
To jakiego alfabetu używamy wynika z tego do jakiego kręgu kultury chrześcijańskiej należy dana grupa Słowian.;What alphabet we use is what circle of Christian culture the Slavic group belongs to.;Słowian;;
On nawet napisał takie zdanie, bardzo znane, słynne zdanie —  A niechaj narodowie wżdy postronni znają, iż Polacy nie gęsi, iż swój język mają.;He even wrote such a sentence, a very well-known, famous sentence, and let the people of the outside know that Poles do not goose, that they have their tongue.;postronni;;
Mówi się nawet kontinuum języków południowosłowiańskich.;Even a continuum of South Slavic languages is spoken.;południowosłowiańskich;;
Zobaczcie jakie to ciekawe, ile słów jest bardzo, bardzo podobnych w języku polskim i sanskrycie, chociaż Indie leżą bardzo daleko od Polski, to jest wiele słów bardzo podobnych w obu językach.;See how interesting it is, how many words are very, very similar in Polish and Sanskrit, although India is very far from Poland, it is many words very similar in both languages.;sanskrycie;;
Rodzimowiercy obchodzą wiele rytuałów związanych z przemianami w przyrodzie, podobnie jak to robili dawni Słowianie.;The families celebrate many rituals related to the transformation of nature, just as the former Slavs did.;Rodzimowiercy;;
Tę piosenkę napisała para autorów Jeremi Przybora i Jerzy Wasowski.;This song was written by a couple of authors Jeremy Przybor and Jerzy Wasowski.;Wasowski;;
Jednym z najważniejszych bogów był Perun.;One of the most important gods was Perun.;Perun;;
W filmie widzimy też Strzygi, czyli takie słowiańskie wampiry.;In the film we also see Strings, which are Slavic vampires.;Strzygi;;
Podobają mi się niektóre religie wschodu, albo ich filozofia, ale to świetnie, że mamy te połączenia z Polską.;I like some Eastern religions or their philosophy, but it's great that we have these connections with Poland.;niektóre;;
Moje rodzinne miasto to Rijeka albo Rzeka po polsku.;My hometown is Rijeka or the Polish River.;Rijeka;;
Tę piosenkę napisała para autorów Jeremi Przybora i Jerzy Wasowski.;This song was written by a couple of authors Jeremy Przybor and Jerzy Wasowski.;Przybora;;
Po prostu —  Daj ja będę mielił,  —  Day, ut ia pobrusa  — a ty odpocznij —  a ti poziwai .;Just let me have it, Day, ut ia pobrusa and you rest a ti poziwai.;mielił;;
Brat.r  to oczywiście brat,  żani  to żona, veda to wiedza,  agni  to ogień.;Brother.r is of course brother, wife is wife, veda is knowledge, agni is fire.;veda;;
Marino jest pierwszym Chorwatem, który przysłał swoje nagranie, więc mamy przykład jak użytkownik języka chorwackiego mówi po polsku.;Marino is the first Croatian to send his recording, so we have an example of how a Croatian speaker speaks Polish.;Chorwatem;;
Sanskryt i język polski Prawdopodobnie słyszeliście o starożytnym języku sanskryt.;Sanskrit and Polish Language You've probably heard of the ancient Sanskrit language.;Sanskryt;;
Ten język powstał jakieś 1000 lat przed naszą erą, czyli przed narodzeniem Chrystusa, i był używany aż do wieku VI-VII wieku naszej ery.;This language was created about 1000 years before our era, or before the birth of Christ, and was used until the age of the VI-VII century of our era.;1000;;
Podobno… podobno, dla Polaka najłatwiejszy jest język słowacki, ale dla Słowaka język polski nie jest wcale najłatwiejszy.;Apparently... it is said that for Poles Slovak is the easiest language, but for Slovak Polish is not the easiest language at all.;Słowaka;;
W języku bułgarskim jest bardzo dużo zapożyczeń z języka tureckiego.;In Bulgarian there are a lot of loans from Turkish.;zapożyczeń;;
Może dla Białorusinów, ale pewnie nie.;Maybe for the Belarusians, but probably not.;Białorusinów;;
W Wiedźminie pojawia się też postać Borowego, czyli demona lasu.;In the witches there is also a figure of Borov, or the demon of the forest.;Borowego;;
OK, mija trochę czasu i w IX wieku bardziej na zachód tego terenu, powoli powstaje organizacja państwowa, z której powstanie przyszła Polska, a na wschodzie powstaje organizacja państwowa Ruś Kijowska założona przez Ruryka I wodza Waregów.;OK, it takes some time and in the 9th century more to the west of this area, the state organization from which the future Poland will arise is slowly formed, and in the east is the state organisation Ruś Kievska founded by Tubek I the Waregów chief.;Waregów;;
Teraz oczywiście Białorusią rządzi Aleksander Łukaszenka, do tego jeszcze dojdziemy.;Now, of course, Alexander Lukashenka is in charge of Belarus, and we will come to that.;Aleksander;;
Po pierwsze w średniowiecznych dokumentach pisanych po łacinie, te tereny są nazywane Ruthenia, a więc Ruthenia znaczy to samo co Ruś.;First of all, in medieval documents written in Latin, these areas are called Ruthenia, so Ruthenia means the same thing as Rus.;Ruthenia;;
To jest dosyć smutne nagranie, Kasia ma bardzo smutny głos, posłuchajmy fragmentu.;This is a pretty sad recording, Kasia has a very sad voice, let's listen to the part.;Kasia;;
Z zachodnich dialektów języka ruskiego powstały dzisiejsze języki białoruski, ukraiński i rusiński, czyli inaczej mówiąc łemkowski.;Today's Belarusian, Ukrainian and Russian languages were created from Western dialects of the Russian language, in other words Lemkovsky.;rusiński;;
OK, mija trochę czasu i w IX wieku bardziej na zachód tego terenu, powoli powstaje organizacja państwowa, z której powstanie przyszła Polska, a na wschodzie powstaje organizacja państwowa Ruś Kijowska założona przez Ruryka I wodza Waregów.;OK, it takes some time and in the 9th century more to the west of this area, the state organization from which the future Poland will arise is slowly formed, and in the east is the state organisation Ruś Kievska founded by Tubek I the Waregów chief.;Ruryka;;
Mongołowie atakowali ze wschodu.;The Mongols attacked from the east.;Mongołowie;;
Ruryk pochodził z Półwyspu Jutlandzkiego i nie był Słowianinem oczywiście, dziś to jest Dania, teren Danii.;The tube came from the Jutland Peninsula and was not Slavic of course, today it is Denmark, the territory of Denmark.;Ruryk;;
Pierwszym carem z dynastii Rurykowiczów był Iwan IV Groźny.;The first tsar from the Rubovych dynasty was Ivan IV the Terrible.;Rurykowiczów;;
Trzecia teoria mówi o tym, że ziemie Rusi nie podbite przez Tatarów były nazywane Białą Rusią.;The third theory is that the lands of Russia not conquered by the Tatars were called White Russia.;Rusią;;
Kniaziowie ruscy, a potem litewsko-ruscy zaczęli tworzyć magnaterię, czyli inaczej mówiąc szlachtę.;The Russian Knazis, and then the Lithuanian-Russians began to create magnateria, or nobility.;magnaterię;;
Myślę, że słyszeliście o Tadeuszu Kościuszce, bo jest on bardzo znany również w Stanach Zjednoczonych.;I think you've heard of Tadeusz Kościuszka, because he's also very famous in the United States.;Kościuszce;;
Jakakolwiek niezależność kulturowa Białorusinów i Polaków była tłumiona przez władze rosyjskie.;Any cultural independence of Belarusians and Poles was suppressed by the Russian authorities.;Białorusinów;;
Życzę Tobie, całej rodzinie i wszystkim Białorusinom wszystkiego dobrego, powodzenia!;I wish you, the whole family and all the Belarusians all the best, good luck!;Białorusinom;;
Ruryk pochodził z Półwyspu Jutlandzkiego i nie był Słowianinem oczywiście, dziś to jest Dania, teren Danii.;The tube came from the Jutland Peninsula and was not Slavic of course, today it is Denmark, the territory of Denmark.;Słowianinem;;
Stopniowo następował proces polonizacji.;The process of polonization gradually followed.;polonizacji;;
Teraz chcę Wam powiedzieć, że Słowianie zaczęli asymilować ludami bałtyckimi, które wcześniej już zamieszkiwały tereny dzisiejszej Białorusi, Ukrainy, częściowo Rosji i Polski.;Now I want to tell you that the Slavs began to assimilate the Baltic peoples, which had already inhabited the territory of today's Belarus, Ukraine, partly Russia and Poland.;asymilować;;
Od tego czasu polonizacja zamieniła się rusyfikację.;Since then, the Polishization has changed its russification.;rusyfikację;;
Nic dziwnego, że Kasia boi się o swoją rodzinę, że wyjechała z Mińska.;No wonder Kasia's afraid for her family that she left Minsk.;Mińska;;
Dziękuję bardzo Haniu!;Thank you very much, Hanya!;Haniu;;
Jednak nadal na tych terenach mieszkali oczywiście  Rusini, Słowianie, których jest wiele, którzy mają znaczną przewagę liczebną nad Litwinami.;However, there were, of course, Rusini, Slavs still living in this area, many of whom are outnumbered by Lithuanians.;Rusini;;
Dodatkowo Polacy przyjmują chrześcijaństwo w obrzędzie zachodnim, a Ruś Kijowska przyjmuje chrzest w obrządku bizantyjskim.;In addition, Poles accept Christianity in the Western rite, and Ruszy Kievska is baptized in the Byzantine rite.;bizantyjskim;;
Teraz chcę Wam powiedzieć, że Słowianie zaczęli asymilować ludami bałtyckimi, które wcześniej już zamieszkiwały tereny dzisiejszej Białorusi, Ukrainy, częściowo Rosji i Polski.;Now I want to tell you that the Slavs began to assimilate the Baltic peoples, which had already inhabited the territory of today's Belarus, Ukraine, partly Russia and Poland.;zamieszkiwały;;
Dlatego czasami mówimy o najeździe mongolskim, czasami o najeździe tatarskim.;That's why sometimes we talk about the Mongolian invasion, sometimes about the Tartar invasion.;najeździe;;
Granica została przesunięta na zachód i Polacy, którzy znajdowali się na wschodzie zostali przesiedleni do Polski.;The border was moved to the west and Poles who were in the east were relocated to Poland.;przesiedleni;;
Bardzo pomocna jest do tego tak zwana Karta Polaka.;The so-called Polish Charter is very helpful.;zwana;;
