Początki zsyłek na Syberię W pierwszej połowie XVII wieku pierwsi polscy zesłańcy byli wysyłani na Urali i Syberię.;In the first half of the 17th century, the first Polish exiles were sent to Urali and Siberia.;zesłańcy;;
Zesłańcy po powstaniach Na Polaków, którzy byli zesłani na Syberię mówimy Sybiracy.;The exiles after the uprisings of the Poles who were sent to Siberia are called the Sibirates.;Sybiracy;;
Zesłańcy to oczywiście ludzie, którzy są wysyłani, zsyłani daleko, daleko od swoich domów.;The exiles are, of course, people who are sent, sent far away, far away from their homes.;zsyłani;;
Katorga to coś znacznie gorszego niż zesłanie.;Katorga is much worse than being sent down.;zesłanie;;
Pond 10 tysięcy Polaków wysłno na Syberię po powstaniu kościuszkowskim, czyli to było 200 lat temu.;Pond 10,000 Poles were sent to Siberia after the Kościuszko Uprising, which was 200 years ago.;kościuszkowskim;;
Dlatego założyłem nowy kurs, założyłem całkiem nową stronę, która nazywa się realkartapolaka.com Tak, dowiadujecie się o tym jako pierwsi, jeszcze nikt o tym nie wie, do tej pory to była tajemnica.;That's why I started a new course, I started a whole new website called realkartapolaka.com Yeah, you're the first to know about it, nobody knows it yet, it's been a secret.;dowiadujecie;;
Komunistyczne gułagi W 1917 wybuchła rewolucja październikowa.;Communist Gulags The October Revolution broke out in 1917.;gułagi;;
Wszystkiego najlepszego i pozdrawiam!;Happy birthday and greetings!;pozdrawiam;;
Wielu polskich jeńców wojennych zostało wtedy osadzonych na tak zwanych pustkach.;Many Polish prisoners of war were then incarcerated in so-called voids.;zwanych;;
To miejsca niewolniczej pracy w nieludzkich warunkach.;These are places of slave labor under inhuman conditions.;nieludzkich;;
Jednorazowo mogło przebywać w obozach ponad 2 miliony ludzi.;One time, more than 2 million people could be in camps.;obozach;;
Komunistyczne gułagi W 1917 wybuchła rewolucja październikowa.;Communist Gulags The October Revolution broke out in 1917.;październikowa;;
Wy mówicie Báthory, tak?;You say Báthora, right?;Báthory;;
Dziś chcę zaprosić Was na rozmowę z jednym Was, z moim słuchaczem z Węgier, który ma na imię Rasid.;Today I want to invite you to talk to one of you, with my listener from Hungary, who is named Rasid.;Węgier;;
-No, wiem, bo uczyłem się pięć lat temu starogreckiego i tam są cztery i polski ma sześć, tak?;- Well, I know, because I studied five years ago in Greek and there are four and the Polish has six, right?;starogreckiego;;
No i… mam lat 27, mam właśnie licencjat z anglistyki i mam magistrat z hungarystyki, to znaczy, że mógłbym uczyć węgierskiego dla obcokrajowców.;And... I'm 27 years old, I have a Bachelor's degree in English, and I have a master's degree in Hungaristics, which means I could teach Hungarian for foreigners.;anglistyki;;
Pozdrawiam bardzo serdecznie pana Nikolaja ze szkoły językowej Eurostudy w Kijowie.;I cordially greet Mr Nikolaj from the Eurostuddy language school in Kiev.;Pozdrawiam;;
Nie jest tak, ale niektórzy tak, kultywują, ja bardzo lubię słuchać, kiedy ktoś mówi tak.;It's not like that, but some people do, and I really like listening when someone says yes.;niektórzy;;
Jeśli słuchasz materiał jakiś, jakiś podkast, jakiś film i nie wszystko rozumiesz, możesz zwracać uwagę właśnie na te rzeczy: jaki ktoś ma głos, jaką ma intonację, czy zadaje pytanie, może odpowiada na pytanie… Ok?;If you're listening to some footage, some podcast, some movie, and you don't understand everything, you can pay attention to these things: what kind of voice someone has, what kind of intonation does he ask a question, maybe answer a question... Okay?;intonację;;
Ale gdy słuchasz, możesz wsłuchiwać się tylko w jedną rzecz, w jeden instrument.;But when you listen, there's only one thing you can listen to, one instrument.;wsłuchiwać;;
Jeśli mózg nie ćwiczy, to traci neurony i połączenia między neuronami.;If the brain isn't practicing, it's losing neurons and connections between neurons.;neuronami;;
Ostatnio Basia napisała do mnie: Dzięki Tobie, mój poziom polskiego jest teraz tak niespodziewane wysoko, że potrafię słuchać mnóstwo innych audycji.;Recently Basia wrote to me: Thanks to you, my Polish level is now so unexpected high that I can listen to a lot of other broadcasts.;Basia;;
Naukowcy mogą nawet zobaczyć, które komórki są dobrze dotlenione, dotlenione czyli mające dużo tlenu.;Scientists can even see which cells are well oxygenated, oxygenated, or having a lot of oxygen.;dotlenione;;
Ciało i umysł to rzeczy, które są ze sobą nierozerwalne.;Body and mind are things that are inseparable.;nierozerwalne;;
Jeśli jesteście tu nowi to przypomnę tylko, że dla początkujących mam kurs  100 Daily Polish Stories , a dla bardziej zaawansowanych kursy  365 Daily Polish Listening  i  Historyjki z Polskimi Idiomami  oraz klub VIP, w którym jest już ponad 300 filmików.;If you are new here I will only remind you that for beginners I have a course of 100 Daily Polish Stories, and for more advanced courses 365 Daily Polish Listening and Stories with Polish Idioms and a VIP club in which there are already more than 300 videos.;Listening;;
W końcu udało się zbudować ogromny akcelerator i odkryto gluon, nową cząsteczkę, która przenosi silne oddziaływanie jądrowe.;Finally, we managed to build a huge accelerator and discovered a gluon, a new molecule that carries a powerful nuclear effect.;gluon;;
Cząstka bardzo ciężka, którą nazwano cząstką Higgsa, bo to właście Richard Higgs pierwszy zaproponował jej istnienie.;A very heavy particle called Higgs, because it was Richard Higgs who first proposed its existence.;Higgsa;;
Richard Feynman powiedział: – Podstawowa reguła jest taka: nie możesz oszukiwać samego siebie i pamiętaj… oszukać siebie jest najłatwiej.;"Richard Feynman said, ""The basic rule is, you can't fool yourself and remember... fool yourself is the easiest.";najłatwiej;;
Po dwudziestu latach dalszej pracy Rutherford odkrył, że jądro atomowe składa się z dwóch mniejszych elementów: z protonów i neutronów.;After twenty years of further work, Rutherford discovered that the atomic nucleus consists of two smaller elements: protons and neutrons.;neutronów;;
Feynman był twórcą elektrodynamiki kwantowej.;Feynman was the creator of quantum electrodynamics.;elektrodynamiki;;
Silne i słabe oddziaływanie jądrowe, elektromagnetyzm i grawitację.;Strong and weak nuclear, electromagnetism and gravity.;elektromagnetyzm;;
Ostatnio zainspirował mnie Richard Feynman.;I was recently inspired by Richard Feynman.;Feynman;;
W tym czasie myślano, że te elementy są zbudowane z niepodzielnych sfer, niepodzielnych kul nazywanych atomami.;At that time, it was thought that these elements were made up of undivided spheres, undivided spheres called atoms.;niepodzielnych;;
Niektórzy używają bardzo trudnych słów, których nauczyli się z książek, albo słowników, ale czasami dla innych te słowa nie są zrozumiałe, dlatego warto używać zwykłych, codziennych słów.;Some use very difficult words that they have learned from books or dictionaries, but sometimes these words are not understandable to others, so it is worth using ordinary, everyday words.;Niektórzy;;
Dlatego, gdy trzymamy jabłko w ręku, jabłko wciąż jest w całości, bo elektrony jabłka odpychają elektrony mojej ręki.;Therefore, when we hold an apple in our hand, the apple is still whole because the electrons of apples push away the electrons of my hand.;odpychają;;
Naukowcy przeprowadzili liczne badania i stwierdzili, że protony, neutrony i elektrony to nie wszystko, musi być coś jeszcze, bo inaczej nie da się wytłumaczyć pewnych doświadczeń, które zrobili.;Scientists have conducted numerous studies and found that protons, neutrons and electrons are not everything, there must be something else, otherwise there is no explanation for some of the experiences they have done.;protony;;
Udowodnił to doświadczalnie Michael Faraday.;Michael Faraday proved it experimentally.;Faraday;;
To jak działa świat, wszechświat, inne galaktyki, podróże w czasie i przestrzeni, to wszystko bardzo rozpala moją wyobraźnię.;The way the world works, the universe, other galaxies, time travel and space, it all really ignites my imagination.;rozpala;;
Obecnie technologia podwaja się co dwa lata.;Now technology doubles every two years.;podwaja;;
Już dziś żyją ludzie, którzy mają wszczepiony w mózg układ komputerowy.;People already live today who have a computer system implanted into their brains.;wszczepiony;;
Pozdrawiam serdecznie!;Greetings!;Pozdrawiam;;
Kiedyś, nasza wiedza podwajała się co 2500 lat.;Once upon a time, our knowledge doubled every 2,500 years.;2500;;
I myślę, że nastała pora, że to już pora, żeby rozpocząć podcast.;And I think it's time to start the podcast.;nastała;;
Jeśli komuś uszkodzi się mózg, to już niedługo będzie można wymienić kilka neuronów i wyleczyć takiego człowieka.;If someone's brain is damaged, it'll be possible to replace a few neurons soon enough and heal a man like that.;neuronów;;
Moi drodzy, na tym chcę skończyć dzisiejsze wybieganie w przyszłość.;Ladies and gentlemen, that's where I want to end up running into the future today.;wybieganie;;
Otóż, chciałbym trochę wybiec w przyszłość, opowiedzieć trochę o niedalekiej, ale bardzo ciekawej przyszłości, o tym co już niedługo za 20, może 30 lat prawdopodobnie zdarzy się na naszej planecie, o tym co jest nieuniknione.;Well, I'd like to run into the future a little bit, tell you a little bit about the near, but very interesting future, about what's going to happen soon in 20, maybe 30 years, probably going to happen on our planet, about what's inevitable.;wybiec;;
Jeśli dziś masz smartfona, inteligentny telefon, to twoja komórka ma większą moc obliczeniową, niż wszystkie komputery razem wzięte 50 lat temu.;If you have a smartphone today, an intelligent phone, then your cell has more computing power than all computers combined 50 years ago.;obliczeniową;;
Jeszcze tylko przypomnę, że czeka na Was klub VIP, że czeka program dla początkujących  100 Daily Polish Stories  i dla średniozawansowanych  365 Daily Polish Listening .;Let me remind you that VIP Club is waiting for you, that there is a program for beginners 100 Daily Polish Stories and for intermediate 365 Daily Polish Listening.;Listening;;
W roku 394 n.e., czyli po narodzinach Chrystusa, powstał ostatni zapis, ostatni dokument napisany przy pomocy hieroglifów, których używano do zapisywania języka egipskiego.;In 394 C.E., or after the birth of Christ, the last record was written, the last document written with hieroglyphs that were used to write the Egyptian language.;hieroglifów;;
Jednym z naukowców był Francuz, Jean Champollion, który od dzieciństwa interesował się Egiptem.;One of the scientists was a Frenchman, Jean Champollion, who had been interested in Egypt since childhood.;Champollion;;
Z języka egipskiego wywodzi się język koptyjski, który dziś jest używany tylko do ceremonii kościelnych przez chrześcijan koptyjskich.;The Egyptian language is derived from the Coptic language, which today is used only for church ceremonies by Coptic Christians.;koptyjski;;
Przeczytałem, że co 2 tygodnie, wymiera jeden język, ok?;I read that every two weeks, one tongue dies out, okay?;wymiera;;
Podczas prac jeden z nich natknął się na wielki kamień, wielki bazaltowy blok, czarną bazaltową płytę.;During the work one of them stumbled upon a large stone, a large basalt block, a black basalt plate.;bazaltowy;;
Jean miał 8 lat, gdy znaleziono kamień z Rosetty i całe swoje wykształcenie postanowił kierować w stronę egiptologii.;Jean was 8 years old when Rosetta's stone was found and his entire education decided to direct Egyptology.;egiptologii;;
W sierpniu w Egipcie jest piekielnie gorąco, wyobrażacie sobie jest temperatura około 50C, w mieście Rosetta, żołnierze umacniali fort.;In August, Egypt is a hell of a heat, you can imagine the temperature is about 50C, in Rosetta, the soldiers strengthened the fort.;Rosetta;;
Cywilizacja egipska trwała 3000 lat, wielka, wielka cywilizacja.;Egyptian civilization lasted 3,000 years, a great, great civilization.;3000;;
Ostatnio napisał do mnie Dmitry z Kijowa, a nawet przysłał swoje nagranie do mnie, posłuchajmy.;Recently he wrote to me Dmitry from Kiev, and even sent his recording to me, let's listen.;Kijowa;;
Zatem tutaj w Polsce powoli zaczyna się jesień, ta słynna złota polska jesień, niektórzy mówią na tę porę roku — babie lato.;"So here in Poland the autumn begins slowly, this famous Polish gold autumn, some of them say for this time of year, ""Baby summer.""";niektórzy;;
Oczywiście uczę się języka polskiego, więc słucham podcasty ze strony realpolish.pl  Przez prawie trzy miesiące przesłuchałem prawie wszystkie podcasty jakie znajdują się na stronie realpolish, teraz studiuję taki kurs, który nazywa się 365 historyjek, Daily Polish Listening.;Of course I am learning Polish, so I listen to podcasts from the site realpolish.pl For almost three months I have listened to almost all podcasts on the site realpolish, now I study a course called 365 stories, Daily Polish Listening.;Listening;;
Francuzi muszą umacniać swoje fortece.;The French must strengthen their fortress.;umacniać;;
Z języka egipskiego wywodzi się język koptyjski, który dziś jest używany tylko do ceremonii kościelnych przez chrześcijan koptyjskich.;The Egyptian language is derived from the Coptic language, which today is used only for church ceremonies by Coptic Christians.;wywodzi;;
Jest mi bardzo miło je dostawać, są dla mnie wielką motywacją do prowadzenia tej strony i pomaganiu Wam w języku polskim i myślę, że są również dobrą motywacją dla wszystkich, którzy uczą się polskiego.;I am very pleased to get them, they are a great motivation for me to run this website and help you in Polish and I think they are also a good motivation for all who are learning Polish.;myślę;;
Pomyślałem, że niektórzy muszą być może zdać taki test i rozwiązanie takiego testu może być ciekawe.;I thought that some people might have to pass this test, and it might be interesting to solve this test.;niektórzy;;
Na koniec chciałbym, żebyśmy posłuchali jeszcze nagrania od Guillermo z Burgos w Hiszpanii, posłuchajcie.;Finally, I'd like us to hear some more footage from Guillermo from Burgos, Spain, listen.;Burgos;;
Zacząłem od kursu na stronie Duolingo, tam nauczyłem się pisać i czytać i trochę rozumieć przez ucho.;I started with a course on the Duolingo website, there I learned to write and read and to understand a little by the ear.;Duolingo;;
Nazywam się Artiom i jestem Rosjaninem, ale mieszkam w Holandii.;My name is Artiom and I am Russian, but I live in Holland.;Artiom;;
Juliusz Cezar zaadoptował kalendarz egipski, czyli przyjął kalendarz egipski, to było jakieś 100 lat przed naszą erą, i dniom nadał nazwy bogów greckich i tak powstał kalendarz juliański.;Julius Caesar adopted the Egyptian calendar, i.e. he accepted the Egyptian calendar, it was about 100 years before our era, and he named the Greek gods for days, and so the Julian calendar was created.;juliański;;
Mam na imię Barbara (Dla Polaków po prostu Basia),  a mieszkam w Belgii.;My name is Barbara (For Poles just Basia), and I live in Belgium.;Basia;;
Ponieważ ta reforma zaszła, gdy papierzem był Grzegorz XIII, dlatego nazwano ten kalendarz, kalendarzem gregoriańskim, od imienia Grzegorz.;Because this reform took place when Grzegorz XIII was a paperwork, this calendar, the Gregorian calendar, was named after Grzegorz.;gregoriańskim;;
15 dnia miesiąca Nissan obchodzi się święto Pascha, albo Pascua.;On the 15th day of the month, Nissan celebrates the Passover or Pascua.;Pascha;;
Dlatego pierwsze kalendarze, to były tak zwane kalendarze lunarne, czyli księżycowe.;That's why the first calendars were called lunar calendars, or lunar calendars.;lunarne;;
Ten rok, w ktorym dodajemy ten dzień, po polsku nazywa się rokiem przestępnym.;This year, in which we add this day, is called the leap year in Polish.;przestępnym;;
Ponieważ lata w tym kalendarzu są liczone od powstania świata, dlatego teraz według tego kalendarza mamy rok 5778.;Because the years in this calendar are counted from the beginning of the world, so now according to this calendar we have the year 5778.;5778;;
Muzułmanie mierzą czas od ucieczki Mahometa z Mekki do Medyny.;Muslims measure the time since Muhammad escaped from Mecca to Medina.;Medyny;;
Ramandan rozpoczyna się, gdy na niebie pojawia się Księżyc w nowiu, aż do kolejnego cyklu w nowiu.;Randan begins when the moon appears in the sky in a new moon until the next cycle in a new moon.;nowiu;;
Oni też są krajem wschodzącego Słońca.;They, too, are the land of the rising sun.;wschodzącego;;
Miło mi jest słyszeć, że robicie postępy, że mówicie coraz lepiej po polsku, niektórzy z dużą łatwością posługują się językiem polskim, no i dodatkowo jest towspaniałe uczucie, gdy wiem, że mogłem Wam w tym pomóc.;I am pleased to hear that you are making progress, that you speak more and more Polish, some of them speak Polish very easily, and it also feels great when I know that I was able to help you with this.;niektórzy;;
W XVI wieku, dokładnie w roku 1582 papierzem był Grzegorz XIII.;In the 16th century, exactly in 1582 Grzegorz XIII was a paper.;papierzem;;
Kalendarz juliański byłby bardzo dobrym kalendarzem, gdyby nie to, że spóźnia się o jeden dzień na 128 lat.;Julian calendar would have been a very good calendar if it hadn't been for one day for 128 years.;spóźnia;;
Nazwa maj pochodzi od bogini Mai, czyli znowu mamy łacińską nazwę, ale staropolska nazwa tego miesiąca to trawień.;The name of May comes from the goddess Mai, which means we have the Latin name again, but the old Polish name of this month is digestive.;trawień;;
W XVI wieku, dokładnie w roku 1582 papierzem był Grzegorz XIII.;In the 16th century, exactly in 1582 Grzegorz XIII was a paper.;1582;;
Podobny do babilońskiego jest kalendarz żydowski.;The Jewish calendar is similar to that of Babylon.;babilońskiego;;
Granica na wschodzie sięgała aż za rzekę Dniepr, aż po Zaporoże Kozackie.;The border in the east reached beyond the river Dniepr, to the Kozackie Zaporozhye.;Zaporoże;;
Wkrótce dojdzie do powstania Kozaków Zaporoskich i chłopstwa ruskiego, czyli czerni, właśnie przeciwko królowi Polski.;Soon there will be an uprising of Zaporozh Cossacks and Russian peasantry, i.e. black, just against the king of Poland.;Zaporoskich;;
Jednym z przywódców ukraińskich nacjonalistów był Stepan Bandera, wróg Rzeczpospolitej i jednocześnie bohater Ukraińców.;One of the leaders of Ukrainian nationalists was Stepan Bandera, an enemy of the Republic and at the same time a hero of the Ukrainians.;Stepan;;
Powstanie Chmielnickiego Ale w 1648 dowódcą powstania był Kozak Bohdan Chmielnicki, który wykorzystał to, że szlachta nie pozwoliła wpisać królowi do rejestru tak dużej liczby Kozaków.;The Uprising of Chmielnicki But in 1648 the commander of the Uprising was Cossack Bohdan Chmielnicki, who used the fact that the nobles did not allow the King to register such a large number of Cossacks.;Chmielnicki;;
Granica na wschodzie sięgała aż za rzekę Dniepr, aż po Zaporoże Kozackie.;The border in the east reached beyond the river Dniepr, to the Kozackie Zaporozhye.;Dniepr;;
Ale przewrotnie, chciałbym, żebyśmy na początek posłuchali nagrania, które dostałem od Niklasa, który mieszka na zachód od Polski, czyli w Niemczech.;But perversely, I would like us to listen to the recordings I received from Niklas, who lives west of Poland, in Germany.;Niklasa;;
W tym czasie rządy sprawowały tu rodziny magnackie, arystokracja, szlachta.;At that time, the rule was ruled by the Magnack families, the aristocracy, the nobles.;magnackie;;
W 1941 w porozumieniu z Abwehrą stworzył batalion „Nachtigall” złożony z Ukraińców i Niemców, ktory był dowodzony przez Niemców.;In 1941, in agreement with Abwehr, he created a battalion of the Ukrainians and Germans, which was commanded by the Germans.;Nachtigall;;
Te obozy nazywały się “sicz”.;"Those camps were called ""Sichich.""";sicz;;
Myślę, że to bardzo ciekawe dla wszystkich, gdy opowiadacie o swojej drodze, o swoich metodach nauki, o swojej motywacji, dlaczego uczycie się polskiego, czy jest łatwo, czy jest trudno, to wszystko jest bardzo interesujące.;I think it's very interesting for everyone when you talk about your way, about your methods of learning, about your motivation, why you learn Polish, whether it's easy or difficult, it's all very interesting.;Myślę;;
Jestem twoim fanem, pozdrawiam z Berlina, cześć!;I'm a fan of yours. Greetings from Berlin.;pozdrawiam;;
Trzeba powiedzieć, Polski rząd w latach 30 prowadził politykę polonizacji Wołynia, czyli terenów południowo-wschodniej Polski, gdzie większość ludności to byli właśnie Ukraińcy.;It has to be said that the Polish government in the 1930s conducted the policy of Polish colonization of Volyn, i.e. the areas of south-eastern Poland, where the majority of the population were Ukrainians.;polonizacji;;
Oczywiście w ten sposób oni tracili swoich chłopów, tak zwaną czerń.;Of course, that's how they lost their peasants, so-called black.;zwaną;;
Mija czas, wybucha II wojna światowa.;Time passes, World War II breaks out.;wybucha;;
Rosja w tym czasie była wroga kozactwu, więc Rosja odpada, Rosja nie mogła pomóc.;Russia was an enemy of the Cossacks at the time, so Russia is out, Russia couldn't help.;odpada;;
Powstanie Chmielnickiego Ale w 1648 dowódcą powstania był Kozak Bohdan Chmielnicki, który wykorzystał to, że szlachta nie pozwoliła wpisać królowi do rejestru tak dużej liczby Kozaków.;The Uprising of Chmielnicki But in 1648 the commander of the Uprising was Cossack Bohdan Chmielnicki, who used the fact that the nobles did not allow the King to register such a large number of Cossacks.;1648;;
Zatem tak jak mówiłem Kozacy to była grupa ludzi o charakterze wieloetnicznym, wielonarodowym, ale największą grupą etniczną byli Rusini.;So, as I said, the Cossacks were a group of people of a multi-ethnic, multinational nature, but the largest ethnic group was Rusini.;Rusini;;
53% Ukraińców była za anulowaniem tytułu dla Bandery, czyli połowa była za odebraniem tytułu Bohatera Ukrainy, 28% była za tym, żeby tytuł nadal należał do Stepana Bandery, a 19% nie miała swojego zdania na ten temat.;53% of Ukrainians were in favour of cancelling the title for Bandera, or half were in favour of taking the title of Hero of Ukraine, 28% were in favour of the title still belonging to Stepan Bandera, and 19% had no opinion on it.;Stepana;;
Pamiętacie w wyniku I wojny światowej upadło Imperium Rosyjskie, było to w 1917 roku, upadła także Monarchia Austro-Węgierska, w ten sposób powstały dwa niepodległe państwa ukraińskie, czyli Ukraińska Republika Ludowa i Zachodnioukraińska Republika Ludowa.;You remember the fall of the Russian Empire in 1917 as a result of World War I, the fall of the Austro-Hungarian Monarchy, thus creating two independent Ukrainian states, the Ukrainian People's Republic and the West-Ukrainian People's Republic.;niepodległe;;
(Przez) pierwszy rok niczego się nie nauczyłem, bo nie wiedziałem czy długo zostanę w Polsce, a w Warszawie prawie wszyscy mówią po angielsku, więc było mi łatwiej, ale zakochałem się dwa razy – pierwszy raz w Warszawie, a drugi raz w cudownej polskiej dziewczynie.;(For) the first year I didn't learn anything, because I didn't know if I would stay in Poland for long, and in Warsaw almost everyone speaks English, so it was easier for me, but I fell in love twice in Warsaw for the first time, and for the second time in a wonderful Polish girl.;łatwiej;;
Tę samą część mózgu, którą blokujemy jeśli nie śpimy wystarczająco długo, a zatem nie możemy przyswajać nowych informacji.;The same part of the brain that we block if we don't sleep long enough, so we can't absorb new information.;przyswajać;;
W naszym mózgu znajduje się tak struktura, która nazywa się hipokamp, po łacinie hippocampus.;There's a structure in our brain called hippocampus, Latin for hippocampus.;hipokamp;;
Okazało się, że podczas niektórych faz snu aktywność elektryczna mózgu jest bardzo duża.;It turned out that during some sleep phases the electrical activity of the brain is very high.;niektórych;;
Wewnątrz mózgu jest struktura, która nazywa się po polsku ciało migdałowate, po angielsku to jest Amygdala.;Inside the brain is a structure that is called the Polish amygdala body, in English it is Amygdala.;migdałowate;;
W naszym mózgu znajduje się tak struktura, która nazywa się hipokamp, po łacinie hippocampus.;There's a structure in our brain called hippocampus, Latin for hippocampus.;hippocampus;;
Aaa… Aaa… Szarobure, szarobure, obydwa.;Ahhhhhhhhhhhhhhhhhhhhhhhhhhhhhhhhhhhhhhhhhhhhhhhhhhhhhhhhhhhhhhhhhhhhhhhhhhhhhhhhhhhhhhhhhhhhhhhhhhhhhhhhhhhhhhhhhhhhhhhhhhhhhhhhhhhhhhhhhhhhhhhhhhhhhhhhhhhhhhhhhhhhhhhhhhhhhhhhhhhhhhhhhhhhhhhhhhhhhhh;Szarobure;;
